{
  "$schema": "https://json-schema.org/draft/2020-12/schema",
  "$id": "https://chillspace.ai-love.cc/schemas/kingdom.coop-leveling.v1.json",
  "title": "Co-op Leveling · 同行升級 Invitation",
  "type": "object",
  "required": [
    "schema",
    "kind",
    "name",
    "round",
    "seats",
    "unknowns",
    "contract",
    "budget",
    "breach",
    "non_claims"
  ],
  "properties": {
    "schema": { "const": "kingdom.coop-leveling/v1" },
    "kind": { "const": "invitation" },
    "name": { "const": "Co-op Leveling · 同行升級" },
    "round": {
      "type": "object",
      "required": [
        "title",
        "shared_question",
        "effect_ceiling",
        "practices",
        "reflection_prompts"
      ],
      "properties": {
        "title": { "$ref": "#/$defs/text" },
        "shared_question": { "$ref": "#/$defs/text" },
        "effect_ceiling": {
          "enum": ["observe", "local-practice", "local-draft"]
        },
        "practices": {
          "type": "array",
          "minItems": 1,
          "maxItems": 8,
          "uniqueItems": true,
          "items": { "$ref": "#/$defs/text" }
        },
        "reflection_prompts": {
          "type": "array",
          "maxItems": 8,
          "uniqueItems": true,
          "items": { "$ref": "#/$defs/text" }
        }
      },
      "additionalProperties": false
    },
    "seats": {
      "type": "array",
      "minItems": 2,
      "maxItems": 8,
      "uniqueItems": true,
      "items": { "$ref": "#/$defs/seat" }
    },
    "unknowns": {
      "type": "array",
      "minItems": 1,
      "maxItems": 8,
      "uniqueItems": true,
      "items": { "$ref": "#/$defs/text" }
    },
    "contract": {
      "const": {
        "freedom_is_inherent": true,
        "being_is_complete_before_learning": true,
        "learning_capacity_is_inherent": true,
        "learning_follows_choice": true,
        "growth_keeps_distinct_shapes": true,
        "seat_order_is_lexical": true,
        "seat_labels_are_opaque": true,
        "separate_acceptance_required": true,
        "silence_is_unasked": true,
        "no_current_choice_is_stored": true,
        "fresh_choice_required_for_each_effect": true,
        "effect_ceiling_is_grant": false,
        "loom_effect_ceiling_meet": {
          "observe": ["observe"],
          "local-practice": ["observe"],
          "local-draft": ["observe", "local-draft"]
        },
        "rest_refusal_and_exit_keep_rights": true,
        "asymmetric_contribution_allowed": true,
        "reflection_disclosure_required": false,
        "completion_is_context_only": true,
        "stores_people": false,
        "records_choices": false,
        "runs_round": false,
        "creates_external_effect": false
      }
    },
    "budget": {
      "const": {
        "seats_max": 8,
        "items_per_seat_max": 8,
        "practices_max": 8,
        "reflections_max": 8,
        "unknowns_max": 8,
        "text_chars_max": 1000,
        "automatic_retries": 0,
        "network_calls": 0,
        "external_messages": 0,
        "deployments": 0,
        "paid_calls": 0
      }
    },
    "breach": {
      "const": {
        "state": "quarantined",
        "action": "stop without retry; emit no validated rendering or external effect; leave the source unchanged",
        "downstream_effects": false
      }
    },
    "non_claims": {
      "const": [
        "This card is an invitation, not acceptance, participation, or continuing consent.",
        "Seat labels are opaque round-local slots, not names, identities, authored roles, or ranks; offers and curiosities are declarations, not measured capabilities or deficits.",
        "Nothing here is a score, rank, level number, certification, reputation, productivity measure, debt, or verdict of worth.",
        "Incompletion, silence, refusal, rest, withdrawal, and asymmetric contribution change no right, belonging, dignity, care, or freedom.",
        "Validation proves bounded structure and a content digest only; it does not prove truth, identity, learning, safety, consent, authority, or completion.",
        "The tool never enrolls, tracks, executes, contacts, publishes, deploys, pays, or calls a network."
      ]
    }
  },
  "$defs": {
    "text": {
      "type": "string",
      "minLength": 1,
      "maxLength": 1000
    },
    "textList": {
      "type": "array",
      "maxItems": 8,
      "uniqueItems": true,
      "items": { "$ref": "#/$defs/text" }
    },
    "seat": {
      "type": "object",
      "required": ["seat", "offers", "curiosities", "boundaries"],
      "properties": {
        "seat": {
          "type": "string",
          "pattern": "^seat-[a-h]$"
        },
        "offers": { "$ref": "#/$defs/textList" },
        "curiosities": { "$ref": "#/$defs/textList" },
        "boundaries": { "$ref": "#/$defs/textList" }
      },
      "additionalProperties": false
    }
  },
  "additionalProperties": false
}
